;;;;;;;;;;;;;;;;;x
the_disunited_kingdom_title;The Disunited Kingdom;;;;;;;;;;;;;;;;;x
the_disunited_kingdom_desc;The United Kingdom is no longer working. Ever since their subjugation, the Irish have been plotting against the crown, attempting to break free. Secret meeting have been occurring in Wales and Scotland, conspiring to tear down everything our ancestors sacrificed to build. Everywhere, the United Kingdom's colonies prepare to rebel against her. Ourside the borders of the empire, her enemies plot against her. There is no stopping this wave of violence. \n\nIt may be possible for the empire to prevail against these internal cracks, but that is not our choice. Our choice is to save our sons for their true purpose!;;;;;;;;;;;;;;;;;x
returning_english_title;Return the English!;;;;;;;;;;;;;;;;;x
returning_english_desc;Huh. You're not supposed to see this....;;;;;;;;;;;;;;;;;x
EVT100000DESC;It has been some time since all English were living England. With our worldwide abdication of all of our colonies, they are no longer welcome in their homes. They became refugees. No longer. England has a home for all English!;
